<?xml version="1.0" encoding="UTF-8"?>
<m:origami version="1" xmlns:m="http://www.mff.cuni.cz/~peckam/java/origamist/diagram/" xmlns:xsi="http://www.w3.org/2001/XMLSchema-instance" xsi:schemaLocation="http://www.mff.cuni.cz/~peckam/java/origamist/diagram/diagram.xsd">
  <author>
    <name>Kawasaki</name>
    <homepage>http://www.mff.cuni.cz</homepage>
  </author>
  <name>Kawasaki rose</name>
  <year>2010</year>
  <shortdesc>A very nice, but hard rose model.</shortdesc>
  <shortdesc lang="cs-CZ">Opravdu překrásná růže, ale složitá.</shortdesc>
  <description>A very nice, but hard rose model. This has nothing to do with the czech film...</description>
  <description lang="cs-CZ">Opravdu překrásná růže, ale složitá. Nemá nic společného s českým filmem...</description>
  <license>
    <name>BSD</name>
    <content>You can do whatever you want except hiding or changing the authorship information.</content>
    <permission>export</permission>
    <permission>edit</permission>
    <permission>distribute</permission>
    
  </license>
  <thumbnail>
    <image type="image/jpeg">0</image>
  </thumbnail>
  <paper>
    <size>
      <width>200</width>
      <height>297</height>
      <unit>mm</unit>
    </size>
    <color>
      <background>#ffff22</background>
    </color>
    <cols>3</cols>
    <rows>3</rows>
  </paper>
  <model>
    <paper>
      <size>
        <width>20</width>
        <height>30</height>
        <unit>cm</unit>
      </size>
      <colors>
        <background>#5555ff</background>
        <foreground>#ff8888</foreground>
      </colors>
      <weight>80</weight>
      <note>A common sheet of red A4 paper.</note>
      <note lang="cs-CZ">Obyčejný červený list papíru A4.</note>
    </paper>
    <steps>
      <step id="1">
        <description>Begin with a square.</description>
        <description lang="cs-CZ">Začneme se čtvercem.</description>      
      </step>
      <step id="2">
      	<description>Rotate it 45° clockwise.</description>
      	<description lang="cs-CZ">Otočte ho o 45° doprava.
      		Tohle je šíleně dlouhý dvouřádkový popisek. Určitě se na jeden řádek nemůže vejít. Lorem ipsum
      		Lorem ipsumLorem ipsumLorem ipsumLorem ipsumLorem ipsumLorem ipsumLorem ipsumLorem ipsumLorem ipsumLorem ipsum</description>
      	<operation type="ROTATE">
      		<angle>0.7853</angle>
      	</operation>
      </step>
      <step id="3">
      	<description>Make a diagonal valley fold.</description>
      	<description lang="cs-CZ">Udělejte na úhlopříčce údolní přehyb.</description>
      	<operation type="VALLEY_FOLD">
      		<startPoint><x>0</x><y>0</y></startPoint>
      		<endPoint><x>0.6666666</x><y>1</y></endPoint>
      		<layer>1</layer>
      	</operation>
      </step>
    </steps>
  </model>
</m:origami>
